{
  "$schema": "https://json-schema.org/draft/2020-12/schema",
  "title": "Educustomize assistant configuration",
  "type": "object",
  "additionalProperties": false,
  "required": [
    "format",
    "schema_version",
    "root",
    "agents"
  ],
  "properties": {
    "format": {
      "const": "discourse-educustomize/agent-config"
    },
    "schema_version": {
      "const": 1
    },
    "root": {
      "type": "string"
    },
    "agents": {
      "type": "array",
      "minItems": 1,
      "maxItems": 21,
      "items": {
        "type": "object",
        "additionalProperties": false,
        "required": [
          "key",
          "name",
          "description",
          "system_prompt",
          "skills",
          "model",
          "enabled",
          "temperature",
          "top_p",
          "tools",
          "delegates"
        ],
        "properties": {
          "key": {
            "type": "string",
            "pattern": "^[a-zA-Z0-9_-]+$",
            "maxLength": 100
          },
          "name": {
            "type": "string",
            "minLength": 1,
            "maxLength": 100,
            "pattern": "\\S"
          },
          "description": {
            "type": "string",
            "minLength": 1,
            "maxLength": 2000,
            "pattern": "\\S"
          },
          "system_prompt": {
            "type": "string",
            "minLength": 1,
            "maxLength": 100000,
            "pattern": "\\S"
          },
          "skills": {
            "type": "array",
            "maxItems": 100,
            "items": {
              "type": "object",
              "additionalProperties": false,
              "required": [
                "name",
                "description",
                "instructions"
              ],
              "properties": {
                "name": {
                  "type": "string",
                  "minLength": 1,
                  "maxLength": 100,
                  "pattern": "\\S"
                },
                "description": {
                  "type": "string",
                  "maxLength": 2000
                },
                "instructions": {
                  "type": "string",
                  "minLength": 1,
                  "maxLength": 100000,
                  "pattern": "\\S"
                }
              }
            }
          },
          "model": {
            "anyOf": [
              {
                "type": "null"
              },
              {
                "type": "object",
                "additionalProperties": false,
                "required": [
                  "provider",
                  "name",
                  "display_name"
                ],
                "properties": {
                  "provider": {
                    "type": "string",
                    "minLength": 1
                  },
                  "name": {
                    "type": "string",
                    "minLength": 1
                  },
                  "display_name": {
                    "type": "string"
                  }
                }
              }
            ]
          },
          "enabled": {
            "type": "boolean"
          },
          "temperature": {
            "type": [
              "number",
              "null"
            ],
            "minimum": 0,
            "maximum": 2
          },
          "top_p": {
            "type": [
              "number",
              "null"
            ],
            "exclusiveMinimum": 0,
            "maximum": 1
          },
          "tools": {
            "type": "array",
            "uniqueItems": true,
            "items": {
              "type": "string",
              "minLength": 1
            }
          },
          "delegates": {
            "type": "array",
            "uniqueItems": true,
            "maxItems": 20,
            "items": {
              "type": "string"
            }
          }
        }
      }
    }
  }
}
